{"schema_version":"1.1.0","year":2025,"generated_at":"2026-09-23T14:34:06.230086+00:00","themes":[{"trend_theme_id":"2025-ai-mcp","cluster_id":"2025-ai","label":"MCP","short_label":"MCP","management_summary":"MCP erweitert Tool- und Datenzugriffe von KI-Systemen und schafft neue Risiken bei Authentisierung, Datenschutz und Missbrauch.","counts":{"items_total":10,"controls_total":10,"components_total":0,"requirements_total":10,"requirements_strong":0,"requirements_medium":0,"requirements_weak":10,"catalog_count":3,"target_object_count":0,"tag_count":1},"radar":{"presence":0.8293,"depth":0.12,"breadth":0.2,"coverage":0.3206},"display":{"presence_pct":83,"depth_pct":12,"breadth_pct":20,"coverage_pct":32,"coverage_label":"punktuell","color":"#A855F7","is_placeholder":false},"top_tags":["llm"],"top_target_objects":["BSI Stand der Technik Kernel","Anwenderkatalog Grundschutz++","Supply Chain Security"],"requirements":[{"requirement_id":"KONF.12.1","title":"Eingabevalidierung","uuid":"4cf4ca7f-0b09-4777-83dc-5569c8e08f63","score":0.6884,"strength":"weak"},{"requirement_id":"KONF.12.1","title":"Eingabevalidierung","uuid":"4cf4ca7f-0b09-4777-83dc-5569c8e08f63","score":0.6884,"strength":"weak"},{"requirement_id":"KONF.12.1","title":"Eingabevalidierung","uuid":"4cf4ca7f-0b09-4777-83dc-5569c8e08f63","score":0.6884,"strength":"weak"},{"requirement_id":"KONF.12.1","title":"Eingabevalidierung","uuid":"4cf4ca7f-0b09-4777-83dc-5569c8e08f63","score":0.6884,"strength":"weak"},{"requirement_id":"DEV.2.6","title":"Widerstandsfähigkeit gegen gängige Angriffsmuster","uuid":"65ec8cf9-f2aa-4eb5-85a6-914c3da3e148","score":0.6498,"strength":"weak"},{"requirement_id":"DEV.2.6","title":"Widerstandsfähigkeit gegen gängige Angriffsmuster","uuid":"65ec8cf9-f2aa-4eb5-85a6-914c3da3e148","score":0.6498,"strength":"weak"},{"requirement_id":"DEV.2.6","title":"Widerstandsfähigkeit gegen gängige Angriffsmuster","uuid":"65ec8cf9-f2aa-4eb5-85a6-914c3da3e148","score":0.6498,"strength":"weak"},{"requirement_id":"DEV.2.6.1","title":"Eingabevalidierung","uuid":"467ae9d3-922b-44eb-9527-d617416e5330","score":0.6437,"strength":"weak"},{"requirement_id":"DEV.2.6.1","title":"Eingabevalidierung","uuid":"467ae9d3-922b-44eb-9527-d617416e5330","score":0.6437,"strength":"weak"},{"requirement_id":"DEV.2.6.1","title":"Eingabevalidierung","uuid":"467ae9d3-922b-44eb-9527-d617416e5330","score":0.6437,"strength":"weak"}],"components":[],"map_position":{"x":500,"y":210}},{"trend_theme_id":"2025-ai-vibe-coding","cluster_id":"2025-ai","label":"Vibe Coding","short_label":"Vibe Coding","management_summary":"LLM-gestützte Codeerzeugung beschleunigt Entwicklung, erhöht aber Risiken durch unsicheren Code, Prompt-Manipulation und Datenabfluss.","counts":{"items_total":18,"controls_total":17,"components_total":1,"requirements_total":18,"requirements_strong":0,"requirements_medium":0,"requirements_weak":18,"catalog_count":4,"target_object_count":0,"tag_count":0},"radar":{"presence":1.0,"depth":0.3,"breadth":0.75,"coverage":0.639},"display":{"presence_pct":100,"depth_pct":30,"breadth_pct":75,"coverage_pct":64,"coverage_label":"substanziell","color":"#9333EA","is_placeholder":false},"top_tags":[],"top_target_objects":["BSI Stand der Technik Kernel","Anwenderkatalog Grundschutz++","Supply Chain Security","Implementierungsvorschlaege Lieferkettensicherheit"],"requirements":[{"requirement_id":"KONF.12.1","title":"Eingabevalidierung","uuid":"4cf4ca7f-0b09-4777-83dc-5569c8e08f63","score":0.6936,"strength":"weak"},{"requirement_id":"KONF.12.1","title":"Eingabevalidierung","uuid":"4cf4ca7f-0b09-4777-83dc-5569c8e08f63","score":0.6936,"strength":"weak"},{"requirement_id":"KONF.12.1","title":"Eingabevalidierung","uuid":"4cf4ca7f-0b09-4777-83dc-5569c8e08f63","score":0.6936,"strength":"weak"},{"requirement_id":"KONF.12.1","title":"Eingabevalidierung","uuid":"4cf4ca7f-0b09-4777-83dc-5569c8e08f63","score":0.6936,"strength":"weak"},{"requirement_id":"DEV.2.6","title":"Widerstandsfähigkeit gegen gängige Angriffsmuster","uuid":"65ec8cf9-f2aa-4eb5-85a6-914c3da3e148","score":0.6777,"strength":"weak"},{"requirement_id":"DEV.2.6","title":"Widerstandsfähigkeit gegen gängige Angriffsmuster","uuid":"65ec8cf9-f2aa-4eb5-85a6-914c3da3e148","score":0.6777,"strength":"weak"},{"requirement_id":"DEV.2.6","title":"Widerstandsfähigkeit gegen gängige Angriffsmuster","uuid":"65ec8cf9-f2aa-4eb5-85a6-914c3da3e148","score":0.6777,"strength":"weak"},{"requirement_id":"DEV.2.6.1","title":"Eingabevalidierung","uuid":"467ae9d3-922b-44eb-9527-d617416e5330","score":0.6716,"strength":"weak"},{"requirement_id":"DEV.2.6.1","title":"Eingabevalidierung","uuid":"467ae9d3-922b-44eb-9527-d617416e5330","score":0.6716,"strength":"weak"},{"requirement_id":"DEV.2.6.1","title":"Eingabevalidierung","uuid":"467ae9d3-922b-44eb-9527-d617416e5330","score":0.6716,"strength":"weak"},{"requirement_id":"KONF.2.7","title":"Souveräne Werkzeuge","uuid":"9b18fd2e-8300-49d5-b244-88df6674c5c6","score":0.6437,"strength":"weak"},{"requirement_id":"KONF.2.7","title":"Souveräne Werkzeuge","uuid":"9b18fd2e-8300-49d5-b244-88df6674c5c6","score":0.6437,"strength":"weak"},{"requirement_id":"KONF.2.7","title":"Souveräne Werkzeuge","uuid":"9b18fd2e-8300-49d5-b244-88df6674c5c6","score":0.6437,"strength":"weak"},{"requirement_id":"KONF.2.7","title":"Souveräne Werkzeuge","uuid":"9b18fd2e-8300-49d5-b244-88df6674c5c6","score":0.6437,"strength":"weak"},{"requirement_id":"ASST.4.3","title":"Autorisierung von Veröffentlichungen","uuid":"fa86f5b3-1e36-40bd-a61e-c58e7eba11c0","score":0.6437,"strength":"weak"},{"requirement_id":"ASST.4.3","title":"Autorisierung von Veröffentlichungen","uuid":"fa86f5b3-1e36-40bd-a61e-c58e7eba11c0","score":0.6437,"strength":"weak"},{"requirement_id":"ASST.4.3","title":"Autorisierung von Veröffentlichungen","uuid":"fa86f5b3-1e36-40bd-a61e-c58e7eba11c0","score":0.6437,"strength":"weak"}],"components":[{"component_id":"2c4ae0d4-91e1-49f6-81fe-d9645ea927fc","title":"Softwareabhaengigkeiten, SBOM und Bibliothekskontrolle","uuid":"2c4ae0d4-91e1-49f6-81fe-d9645ea927fc","score":0.6838,"strength":"weak"}],"map_position":{"x":600,"y":230}},{"trend_theme_id":"2025-cloud-eu-alternatives","cluster_id":"2025-cloud","label":"Europäische Alternativen","short_label":"EU-Cloud","management_summary":"Europäische Cloud-Alternativen sollen Abhängigkeiten reduzieren und Sicherheitsinteressen besser absichern.","counts":{"items_total":166,"controls_total":158,"components_total":8,"requirements_total":166,"requirements_strong":0,"requirements_medium":11,"requirements_weak":155,"catalog_count":4,"target_object_count":0,"tag_count":0},"radar":{"presence":1.0,"depth":0.3,"breadth":0.75,"coverage":0.639},"display":{"presence_pct":100,"depth_pct":30,"breadth_pct":75,"coverage_pct":64,"coverage_label":"substanziell","color":"#2563EB","is_placeholder":false},"top_tags":[],"top_target_objects":["BSI Stand der Technik Kernel","Anwenderkatalog Grundschutz++","Supply Chain Security","Implementierungsvorschlaege Lieferkettensicherheit"],"requirements":[{"requirement_id":"BES.1.4","title":"Outsourcing-Strategie","uuid":"302952ea-72e1-4104-9cbb-678717a267db","score":0.78,"strength":"medium"},{"requirement_id":"BES.1.4","title":"Outsourcing-Strategie","uuid":"302952ea-72e1-4104-9cbb-678717a267db","score":0.78,"strength":"medium"},{"requirement_id":"BES.1.4","title":"Outsourcing-Strategie","uuid":"302952ea-72e1-4104-9cbb-678717a267db","score":0.78,"strength":"medium"},{"requirement_id":"BES.1.4","title":"Outsourcing-Strategie","uuid":"302952ea-72e1-4104-9cbb-678717a267db","score":0.78,"strength":"medium"},{"requirement_id":"BES.7.4.11","title":"Dokumentierte Mandantentrennung","uuid":"d59ad53c-00d4-4bfd-8af9-bf09722731c5","score":0.7214,"strength":"medium"},{"requirement_id":"BES.7.4.11","title":"Dokumentierte Mandantentrennung","uuid":"d59ad53c-00d4-4bfd-8af9-bf09722731c5","score":0.7214,"strength":"medium"},{"requirement_id":"BES.7.4.11","title":"Dokumentierte Mandantentrennung","uuid":"d59ad53c-00d4-4bfd-8af9-bf09722731c5","score":0.7214,"strength":"medium"},{"requirement_id":"BES.7.4.11","title":"Dokumentierte Mandantentrennung","uuid":"d59ad53c-00d4-4bfd-8af9-bf09722731c5","score":0.7214,"strength":"medium"},{"requirement_id":"BES.2.3","title":"Vereinbarung des Rechtsraums und der Datenlokation","uuid":"00330bf7-9ed8-4606-bf6c-2657e7c47c61","score":0.6936,"strength":"weak"},{"requirement_id":"BES.2.3","title":"Vereinbarung des Rechtsraums und der Datenlokation","uuid":"00330bf7-9ed8-4606-bf6c-2657e7c47c61","score":0.6936,"strength":"weak"},{"requirement_id":"BES.2.3","title":"Vereinbarung des Rechtsraums und der Datenlokation","uuid":"00330bf7-9ed8-4606-bf6c-2657e7c47c61","score":0.6936,"strength":"weak"},{"requirement_id":"BES.2.3","title":"Vereinbarung des Rechtsraums und der Datenlokation","uuid":"00330bf7-9ed8-4606-bf6c-2657e7c47c61","score":0.6936,"strength":"weak"},{"requirement_id":"BES.7.4.6","title":"Shared Responsibility","uuid":"e7afc3eb-feac-4cad-8ad4-a46a867f45d8","score":0.6936,"strength":"weak"},{"requirement_id":"BES.7.4.6","title":"Shared Responsibility","uuid":"e7afc3eb-feac-4cad-8ad4-a46a867f45d8","score":0.6936,"strength":"weak"},{"requirement_id":"BES.7.4.6","title":"Shared Responsibility","uuid":"e7afc3eb-feac-4cad-8ad4-a46a867f45d8","score":0.6936,"strength":"weak"},{"requirement_id":"BES.7.4.6","title":"Shared Responsibility","uuid":"e7afc3eb-feac-4cad-8ad4-a46a867f45d8","score":0.6936,"strength":"weak"},{"requirement_id":"BES.2.2","title":"Dokumentation des Rechtsraums und der Datenlokation","uuid":"d4001ad1-3cac-4b4c-b075-dae3a8678a65","score":0.6936,"strength":"weak"},{"requirement_id":"BES.2.2","title":"Dokumentation des Rechtsraums und der Datenlokation","uuid":"d4001ad1-3cac-4b4c-b075-dae3a8678a65","score":0.6936,"strength":"weak"},{"requirement_id":"BES.2.2","title":"Dokumentation des Rechtsraums und der Datenlokation","uuid":"d4001ad1-3cac-4b4c-b075-dae3a8678a65","score":0.6936,"strength":"weak"},{"requirement_id":"BES.2.2","title":"Dokumentatio